{
  "schema": "mode/v2",
  "id": "studio",
  "description": "Text chat mode with the integrated llama.cpp web interface enabled.",
  "services": {
    "ui": true,
    "vision": false
  },
  "sampling": {
    "temp": 0.7,
    "top_p": 0.8,
    "top_k": 20,
    "min_p": 0.0,
    "presence_penalty": 1.5,
    "repeat_penalty": 1.0,
    "reasoning": "off"
  }
}
